{
  "schemaVersion": 1,
  "contractVersion": 1,
  "contentId": "act01.solaris.algwar_05",
  "storyId": "act01.solaris.algwar_05",
  "namespace": "act01.solaris",
  "version": 1,
  "owner": {"agentId": "narrative-agent-sidelines"},
  "source": {"path": "stories/act_01/solaris/algwar_05.json"},
  "stableIds": {
    "nodePrefix": "act01.solaris.algwar_05.node.",
    "choicePrefix": "act01.solaris.algwar_05.choice."
  },
  "localization": {
    "keys": [
      "story.act01.solaris.algwar_05.start",
      "story.act01.solaris.algwar_05.stage_done"
    ]
  },
  "dependencies": {
    "events": ["flight.entered_region"],
    "consequences": ["story.stage", "world.consequence"],
    "narratives": []
  },
  "narrative": {
    "id": "act01.solaris.algwar_05",
    "version": 1,
    "startNodeId": "act01.solaris.algwar_05.node.start",
    "nodes": [
      {
        "id": "act01.solaris.algwar_05.node.start",
        "textKey": "story.act01.solaris.algwar_05.start",
        "enterEventType": "flight.entered_region",
        "choices": [
          {
            "id": "act01.solaris.algwar_05.choice.side_karma",
            "targetNodeId": "act01.solaris.algwar_05.node.stage_done",
            "consequences": ["world.consequence"]
          },
          {
            "id": "act01.solaris.algwar_05.choice.side_mitra",
            "targetNodeId": "act01.solaris.algwar_05.node.stage_done",
            "consequences": ["world.consequence"]
          }
        ]
      },
      {
        "id": "act01.solaris.algwar_05.node.stage_done",
        "textKey": "story.act01.solaris.algwar_05.stage_done",
        "enterConsequences": ["story.stage"],
        "terminal": true
      }
    ]
  }
}

