{
  "schemaVersion": 1,
  "contractVersion": 1,
  "contentId": "act01.solaris.char_lena",
  "storyId": "act01.solaris.char_lena",
  "namespace": "act01.solaris",
  "version": 1,
  "owner": {"agentId": "narrative-agent-sidelines"},
  "source": {"path": "stories/act_01/solaris/char_lena.json"},
  "stableIds": {
    "nodePrefix": "act01.solaris.char_lena.node.",
    "choicePrefix": "act01.solaris.char_lena.choice."
  },
  "localization": {
    "keys": [
      "story.act01.solaris.char_lena.start",
      "story.act01.solaris.char_lena.stage_done"
    ]
  },
  "dependencies": {
    "events": ["flight.entered_region"],
    "consequences": ["character.trust", "trait.add"],
    "narratives": []
  },
  "narrative": {
    "id": "act01.solaris.char_lena",
    "version": 1,
    "startNodeId": "act01.solaris.char_lena.node.start",
    "nodes": [
      {
        "id": "act01.solaris.char_lena.node.start",
        "textKey": "story.act01.solaris.char_lena.start",
        "enterEventType": "flight.entered_region",
        "choices": [
          {
            "id": "act01.solaris.char_lena.choice.make_promise",
            "targetNodeId": "act01.solaris.char_lena.node.stage_done",
            "consequences": ["character.trust", "trait.add"]
          },
          {
            "id": "act01.solaris.char_lena.choice.keep_distance",
            "targetNodeId": "act01.solaris.char_lena.node.stage_done",
            "consequences": []
          }
        ]
      },
      {
        "id": "act01.solaris.char_lena.node.stage_done",
        "textKey": "story.act01.solaris.char_lena.stage_done",
        "terminal": true
      }
    ]
  }
}
