{
  "schemaVersion": 1,
  "contractVersion": 1,
  "contentId": "act01.haven.zazor_04",
  "storyId": "act01.haven.zazor_04",
  "namespace": "act01.haven",
  "version": 1,
  "owner": {"agentId": "narrative-agent-sidelines"},
  "source": {"path": "stories/act_01/haven/zazor_04.json"},
  "stableIds": {
    "nodePrefix": "act01.haven.zazor_04.node.",
    "choicePrefix": "act01.haven.zazor_04.choice."
  },
  "localization": {
    "keys": [
      "story.act01.haven.zazor_04.start",
      "story.act01.haven.zazor_04.stage_done"
    ]
  },
  "dependencies": {
    "events": ["flight.entered_region"],
    "consequences": ["story.stage", "trait.add", "character.trust", "thread.resonance", "story.flag"],
    "narratives": []
  },
  "narrative": {
    "id": "act01.haven.zazor_04",
    "version": 1,
    "startNodeId": "act01.haven.zazor_04.node.start",
    "nodes": [
      {
        "id": "act01.haven.zazor_04.node.start",
        "textKey": "story.act01.haven.zazor_04.start",
        "enterEventType": "flight.entered_region",
        "choices": [
          {
            "id": "act01.haven.zazor_04.choice.cross_the_gap",
            "targetNodeId": "act01.haven.zazor_04.node.stage_done",
            "consequences": ["trait.add", "thread.resonance"]
          },
          {
            "id": "act01.haven.zazor_04.choice.hold_position",
            "targetNodeId": "act01.haven.zazor_04.node.stage_done",
            "consequences": ["character.trust"]
          }
        ]
      },
      {
        "id": "act01.haven.zazor_04.node.stage_done",
        "textKey": "story.act01.haven.zazor_04.stage_done",
        "enterConsequences": ["story.stage", "story.flag"],
        "terminal": true
      }
    ]
  }
}
