{
  "schemaVersion": 1,
  "contractVersion": 1,
  "contentId": "act01.solaris.sigma_01",
  "storyId": "act01.solaris.sigma_01",
  "namespace": "act01.solaris",
  "version": 1,
  "owner": {"agentId": "narrative-agent-sidelines"},
  "source": {"path": "stories/act_01/solaris/sigma_01.json"},
  "stableIds": {
    "nodePrefix": "act01.solaris.sigma_01.node.",
    "choicePrefix": "act01.solaris.sigma_01.choice."
  },
  "localization": {
    "keys": [
      "story.act01.solaris.sigma_01.start",
      "story.act01.solaris.sigma_01.stage_done"
    ]
  },
  "dependencies": {
    "events": ["flight.entered_region"],
    "consequences": ["story.stage", "trait.add", "character.trust"],
    "narratives": []
  },
  "narrative": {
    "id": "act01.solaris.sigma_01",
    "version": 1,
    "startNodeId": "act01.solaris.sigma_01.node.start",
    "nodes": [
      {
        "id": "act01.solaris.sigma_01.node.start",
        "textKey": "story.act01.solaris.sigma_01.start",
        "enterEventType": "flight.entered_region",
        "choices": [
          {
            "id": "act01.solaris.sigma_01.choice.open_channel",
            "targetNodeId": "act01.solaris.sigma_01.node.stage_done",
            "consequences": ["character.trust", "trait.add"]
          },
          {
            "id": "act01.solaris.sigma_01.choice.stay_guarded",
            "targetNodeId": "act01.solaris.sigma_01.node.stage_done",
            "consequences": ["trait.add"]
          }
        ]
      },
      {
        "id": "act01.solaris.sigma_01.node.stage_done",
        "textKey": "story.act01.solaris.sigma_01.stage_done",
        "enterConsequences": ["story.stage"],
        "terminal": true
      }
    ]
  }
}
