{
  "schemaVersion": 1,
  "contractVersion": 1,
  "contentId": "act01.solaris.impulse",
  "storyId": "act01.solaris.impulse",
  "namespace": "act01.solaris",
  "version": 1,
  "owner": {"agentId": "narrative-agent-mainline"},
  "source": {"path": "stories/act_01/solaris/impulse.json"},
  "stableIds": {
    "nodePrefix": "act01.solaris.impulse.node.",
    "choicePrefix": "act01.solaris.impulse.choice."
  },
  "localization": {
    "keys": [
      "story.act01.solaris.impulse.start",
      "story.act01.solaris.impulse.stage_done"
    ]
  },
  "dependencies": {
    "events": ["thread.resonance_detected"],
    "consequences": ["story.stage", "thread.resonance", "character.trust"],
    "narratives": []
  },
  "narrative": {
    "id": "act01.solaris.impulse",
    "version": 1,
    "startNodeId": "act01.solaris.impulse.node.start",
    "nodes": [
      {
        "id": "act01.solaris.impulse.node.start",
        "textKey": "story.act01.solaris.impulse.start",
        "enterEventType": "thread.resonance_detected",
        "choices": [
          {
            "id": "act01.solaris.impulse.choice.answer",
            "targetNodeId": "act01.solaris.impulse.node.stage_done",
            "consequences": ["thread.resonance", "character.trust"]
          },
          {
            "id": "act01.solaris.impulse.choice.observe",
            "targetNodeId": "act01.solaris.impulse.node.stage_done",
            "consequences": []
          }
        ]
      },
      {
        "id": "act01.solaris.impulse.node.stage_done",
        "textKey": "story.act01.solaris.impulse.stage_done",
        "enterConsequences": ["story.stage"],
        "terminal": true
      }
    ]
  }
}
