{
  "schemaVersion": 1,
  "contractVersion": 1,
  "contentId": "act01.solaris.route",
  "storyId": "act01.solaris.route",
  "namespace": "act01.solaris",
  "version": 1,
  "owner": {"agentId": "narrative-agent-mainline"},
  "source": {"path": "stories/act_01/solaris/route.json"},
  "stableIds": {
    "nodePrefix": "act01.solaris.route.node.",
    "choicePrefix": "act01.solaris.route.choice."
  },
  "localization": {
    "keys": [
      "story.act01.solaris.route.start",
      "story.act01.solaris.route.stage_done"
    ]
  },
  "dependencies": {
    "events": ["flight.entered_region"],
    "consequences": ["story.stage", "trait.add", "thread.resonance", "character.trust"],
    "narratives": []
  },
  "narrative": {
    "id": "act01.solaris.route",
    "version": 1,
    "startNodeId": "act01.solaris.route.node.start",
    "nodes": [
      {
        "id": "act01.solaris.route.node.start",
        "textKey": "story.act01.solaris.route.start",
        "enterEventType": "flight.entered_region",
        "choices": [
          {
            "id": "act01.solaris.route.choice.follow",
            "targetNodeId": "act01.solaris.route.node.stage_done",
            "consequences": ["story.stage", "character.trust"]
          },
          {
            "id": "act01.solaris.route.choice.deviate",
            "targetNodeId": "act01.solaris.route.node.stage_done",
            "consequences": ["story.stage", "trait.add", "thread.resonance"]
          }
        ]
      },
      {
        "id": "act01.solaris.route.node.stage_done",
        "textKey": "story.act01.solaris.route.stage_done",
        "terminal": true
      }
    ]
  }
}
