{
  "schemaVersion": 1,
  "contractVersion": 1,
  "contentId": "act01.solaris.sigma_03",
  "storyId": "act01.solaris.sigma_03",
  "namespace": "act01.solaris",
  "version": 1,
  "owner": {"agentId": "narrative-agent-sidelines"},
  "source": {"path": "stories/act_01/solaris/sigma_03.json"},
  "stableIds": {
    "nodePrefix": "act01.solaris.sigma_03.node.",
    "choicePrefix": "act01.solaris.sigma_03.choice."
  },
  "localization": {
    "keys": [
      "story.act01.solaris.sigma_03.start",
      "story.act01.solaris.sigma_03.stage_done"
    ]
  },
  "dependencies": {
    "events": ["flight.entered_region"],
    "consequences": ["story.stage", "trait.add", "thread.resonance"],
    "narratives": []
  },
  "narrative": {
    "id": "act01.solaris.sigma_03",
    "version": 1,
    "startNodeId": "act01.solaris.sigma_03.node.start",
    "nodes": [
      {
        "id": "act01.solaris.sigma_03.node.start",
        "textKey": "story.act01.solaris.sigma_03.start",
        "enterEventType": "flight.entered_region",
        "choices": [
          {
            "id": "act01.solaris.sigma_03.choice.deep_scan",
            "targetNodeId": "act01.solaris.sigma_03.node.stage_done",
            "consequences": ["trait.add", "thread.resonance"]
          },
          {
            "id": "act01.solaris.sigma_03.choice.shallow_pass",
            "targetNodeId": "act01.solaris.sigma_03.node.stage_done",
            "consequences": []
          }
        ]
      },
      {
        "id": "act01.solaris.sigma_03.node.stage_done",
        "textKey": "story.act01.solaris.sigma_03.stage_done",
        "enterConsequences": ["story.stage"],
        "terminal": true
      }
    ]
  }
}
