{
  "schemaVersion": 1,
  "contractVersion": 1,
  "contentId": "act01.haven.zazor_02",
  "storyId": "act01.haven.zazor_02",
  "namespace": "act01.haven",
  "version": 1,
  "owner": {"agentId": "narrative-agent-sidelines"},
  "source": {"path": "stories/act_01/haven/zazor_02.json"},
  "stableIds": {
    "nodePrefix": "act01.haven.zazor_02.node.",
    "choicePrefix": "act01.haven.zazor_02.choice."
  },
  "localization": {
    "keys": [
      "story.act01.haven.zazor_02.start",
      "story.act01.haven.zazor_02.stage_done"
    ]
  },
  "dependencies": {
    "events": ["flight.entered_region"],
    "consequences": ["story.stage", "trait.add", "thread.resonance"],
    "narratives": []
  },
  "narrative": {
    "id": "act01.haven.zazor_02",
    "version": 1,
    "startNodeId": "act01.haven.zazor_02.node.start",
    "nodes": [
      {
        "id": "act01.haven.zazor_02.node.start",
        "textKey": "story.act01.haven.zazor_02.start",
        "enterEventType": "flight.entered_region",
        "choices": [
          {
            "id": "act01.haven.zazor_02.choice.listen_in",
            "targetNodeId": "act01.haven.zazor_02.node.stage_done",
            "consequences": ["trait.add", "thread.resonance"]
          },
          {
            "id": "act01.haven.zazor_02.choice.block_channel",
            "targetNodeId": "act01.haven.zazor_02.node.stage_done",
            "consequences": []
          }
        ]
      },
      {
        "id": "act01.haven.zazor_02.node.stage_done",
        "textKey": "story.act01.haven.zazor_02.stage_done",
        "enterConsequences": ["story.stage"],
        "terminal": true
      }
    ]
  }
}
