{
  "schemaVersion": 1,
  "contractVersion": 1,
  "contentId": "act01.solaris.packet",
  "storyId": "act01.solaris.packet",
  "namespace": "act01.solaris",
  "version": 1,
  "owner": {"agentId": "narrative-agent-mainline"},
  "source": {"path": "stories/act_01/solaris/packet.json"},
  "stableIds": {
    "nodePrefix": "act01.solaris.packet.node.",
    "choicePrefix": "act01.solaris.packet.choice."
  },
  "localization": {
    "keys": [
      "story.act01.solaris.packet.start",
      "story.act01.solaris.packet.stage_done"
    ]
  },
  "dependencies": {
    "events": ["flight.entered_region"],
    "consequences": ["story.stage", "story.flag"],
    "narratives": []
  },
  "narrative": {
    "id": "act01.solaris.packet",
    "version": 1,
    "startNodeId": "act01.solaris.packet.node.start",
    "nodes": [
      {
        "id": "act01.solaris.packet.node.start",
        "textKey": "story.act01.solaris.packet.start",
        "enterEventType": "flight.entered_region",
        "choices": [
          {
            "id": "act01.solaris.packet.choice.reply",
            "targetNodeId": "act01.solaris.packet.node.stage_done",
            "consequences": ["story.flag"]
          },
          {
            "id": "act01.solaris.packet.choice.archive",
            "targetNodeId": "act01.solaris.packet.node.stage_done",
            "consequences": []
          }
        ]
      },
      {
        "id": "act01.solaris.packet.node.stage_done",
        "textKey": "story.act01.solaris.packet.stage_done",
        "enterConsequences": ["story.stage"],
        "terminal": true
      }
    ]
  }
}
